{"advisory_only":true,"decision_threshold":0.5,"features":["battery_voltage_v_mean","battery_voltage_v_min","battery_current_a_mean","battery_current_a_max","accel_magnitude_mps2_mean","accel_magnitude_mps2_max","gyro_magnitude_radps_mean","gyro_magnitude_radps_max","velocity_magnitude_mps_mean","velocity_magnitude_mps_max","ekf_test_ratio_max","attitude_abs_rad_max"],"imputation_medians":[21.40599670410156,21.144615173339844,12.170599555969238,13.454000473022461,10.001386364796437,13.569126646545733,0.17318640598639023,0.48757737716018495,0.31237476865240155,0.48612022990452475,0.062148451805114746,1.582390713730392],"lineage":{"config_sha256":"cc6e75f5e5a7248d1979d2dceb22924fe9129316503518599f6f7983f7a47b70","experiment":"skyforge-real-anomaly-experiment-2","report_sha256":"5ccad4e7d131976ad527da123e66f0f0745b6fa4e175403cc9d3fe1848382ddd"},"model_kind":"binary-decision-tree","persistence_windows":2,"schema_version":"1.0.0","tree":{"anomaly_probability":[0.4999999999999982,0.19708400869122386,0.13368856408999952,0.021087275635778977,0.004603167455649654,0.033755498982754706,0.0,0.20132778501318235,0.36883147113594045,0.0,0.30950802639098096,0.04711637104328036,0.0,0.21843121036669425,0.41131272226981236,0.6856261173550142,0.31826117857915337,0.4483472668810285,0.07942853562253258,0.024682415434103582,0.11810084597324191,0.0,0.30472130517003754,0.8371970147282214,0.9834598448312015,0.29538604940189533,0.5993677377072006,0.5313775810333697,0.5760089100770238,0.4414838209180662,0.3496993602262423,0.8793007769145393,0.6780136253589335,0.25868165199496435,0.737814800654845,0.12361660629701844,0.028140123429383237,0.0,0.21843121036669425,0.28449165856213027,0.0,0.4787009063444107,0.8310122705706721,0.7431020557046448,0.5465363610232821,0.7305895914272295,0.2561498046611879,0.8518103176690586,0.7962182490152534,0.9900629881582262,0.9200677194093779,0.818952150376758,0.5936457982091342,0.9473639256048343,0.9588502269288955,0.9126293170288652,1.0],"feature_index":[9,1,2,9,10,-1,-1,9,-1,-1,6,2,-1,-1,4,-1,-1,8,2,11,-1,-1,-1,0,-1,-1,9,4,2,10,-1,-1,7,-1,-1,2,8,-1,-1,6,-1,-1,9,7,5,-1,-1,11,-1,-1,6,1,-1,-1,11,-1,-1],"left":[1,2,3,4,5,-1,-1,8,-1,-1,11,12,-1,-1,15,-1,-1,18,19,20,-1,-1,-1,24,-1,-1,27,28,29,30,-1,-1,33,-1,-1,36,37,-1,-1,40,-1,-1,43,44,45,-1,-1,48,-1,-1,51,52,-1,-1,55,-1,-1],"right":[26,17,10,7,6,-1,-1,9,-1,-1,14,13,-1,-1,16,-1,-1,23,22,21,-1,-1,-1,25,-1,-1,42,35,32,31,-1,-1,34,-1,-1,39,38,-1,-1,41,-1,-1,50,47,46,-1,-1,49,-1,-1,54,53,-1,-1,56,-1,-1],"threshold":[0.29500867426395416,23.134238243103027,12.382108211517334,0.26677951216697693,0.0192341236397624,-2.0,-2.0,0.2816794812679291,-2.0,-2.0,0.11535131931304932,13.46019983291626,-2.0,-2.0,9.976701259613037,-2.0,-2.0,0.10585301741957664,0.23559999465942383,1.5173529982566833,-2.0,-2.0,-2.0,23.493638038635254,-2.0,-2.0,1.9786673784255981,11.231446266174316,12.375199794769287,1.0036327838897705,-2.0,-2.0,0.3918474316596985,-2.0,-2.0,13.535839557647705,1.1313822865486145,-2.0,-2.0,0.3372626304626465,-2.0,-2.0,3.2742273807525635,0.7575425505638123,14.311756134033203,-2.0,-2.0,1.7569857239723206,-2.0,-2.0,0.24982990324497223,21.95899486541748,-2.0,-2.0,1.686091423034668,-2.0,-2.0]},"version":"skyforge-real-anomaly-2.0.0"}
